PubmedID,Title,Publication Date,Non-academic Author(s),Company Affiliation(s),Corresponding Author Email
40728018,"The Experiences of Nurses Who Participated in Disaster Relief Efforts After the February 6, 2023 Earthquakes in Türkiye: A Qualitative Study.",2025,Gülen Sibel,"provincial quality coordinator, düzce provincial health directorate, düzce, türkiye.",N/A
40683873,Flexible joints for seismic-resilient design of masonry-infilled RC frames.,2025,Tubaldi Enrico; Rosen Britta,"university of strathclyde, glasgow, united kingdom. enrico.tubaldi@strath.ac.uk.; sda engineering gmbh, herzogenrath, germany.",enrico.tubaldi@strath.ac.uk
40677127,Self-Management and Affecting Factors in Dialysis Patients Experiencing the Earthquake in Türkiye.,2025,Gündoğan Reva,"adıyaman provincial health directorate, adıyaman provincial ambulance service, adıyaman, türkiye.",N/A
40677021,The Statuses of Colonoscopy and Colorectal Cancer According to Big National Disasters Such as COVID-19 and Earthquake.,2025,Maeda-Minami Ayako; Mano Yasunari,"department of clinical drug informatics, faculty of pharmaceutical sciences, tokyo university of science, tokyo, japan.; department of clinical drug informatics, faculty of pharmaceutical sciences, tokyo university of science, tokyo, japan.",N/A
40674485,Global earthquake detection and warning using Android phones.,2025,Allen Richard M; Barski Alexei; Berman Micah; Bosch Robert; Cho Youngmin; Jiang Xia Summer; Lee Yun-Ling; Malkos Steve; Mousavi S Mostafa; Robertson Patrick; Spooner Boone; Stogaitis Marc; Thiruverahan Nivetha; Wimpey Greg,"google llc, mountain view, ca, usa.; google llc, mountain view, ca, usa.; google llc, mountain view, ca, usa.; google llc, mountain view, ca, usa.; google llc, mountain view, ca, usa.; google llc, mountain view, ca, usa.; google llc, mountain view, ca, usa.; google llc, mountain view, ca, usa.; google llc, mountain view, ca, usa.; google germany gmbh, munich, germany.; google llc, mountain view, ca, usa.; google llc, mountain view, ca, usa.; google llc, mountain view, ca, usa.; google llc, mountain view, ca, usa.",N/A
